entity,cluster,cluster_category,entity_categories
organic lip gloss,2,Seasonal,Steady Growth
organic lip plumper,0,Seasonal,Seasonal
organic lip plumping gloss,14,Seasonal,Slowing Growth
origins lip gloss,2,Seasonal,Seasonal
otc lip plumper,0,Seasonal,Seasonal
outrageous effect volume lip gloss,63,Seasonal,Seasonal
outrageous lip gloss,2,Seasonal,Slowing Growth
overnight lip plumper,0,Seasonal,Seasonal
oxx lip gloss,2,Seasonal,Slowing Growth
oz lab lip gloss,2,Seasonal,Steady Growth
pacifica lip gloss,2,Seasonal,Steady Decreasing
paese beauty lip gloss,86,Seasonal,Slowing Growth
paese lip gloss,2,Seasonal,Slowing Growth
painful lip plumper,0,Seasonal,Slowing Growth
pale pink lip gloss,36,Seasonal,Seasonal
palladio lip gloss,2,Seasonal,Seasonal
palladio plump and shine lip gloss,19,Seasonal,Slowing Growth
palm tree fake tattoo,5,Seasonal,Slowing Growth
paprika lip plumper,0,Seasonal,Seasonal
paramore fake happy tattoo,81,Seasonal,Stable
paris hilton lip gloss,2,Seasonal,Seasonal
paris hilton wonderskin,23,Slowing Growth,Slowing Growth
pastel lip gloss,2,Seasonal,Seasonal
pat mcgrath blitz gold lip gloss,2,Seasonal,Steady Decreasing
pat mcgrath divine rose lip gloss,2,Seasonal,Steady Growth
pat mcgrath euphoria,95,Slowing Growth,Slowing Growth
pat mcgrath gold lip gloss,2,Seasonal,Steady Decreasing
pat mcgrath labs lip gloss,2,Seasonal,Slowing Growth
pat mcgrath labs lust lip gloss,2,Seasonal,Steady Decreasing
pat mcgrath lip gloss,2,Seasonal,Seasonal
pat mcgrath lust lip gloss,2,Seasonal,Steady Decreasing
pat mcgrath peach perversion lip gloss,2,Seasonal,Steady Growth
pat mcgrath secret lover lip gloss,2,Seasonal,Steady Growth
patrick ta lip gloss,2,Seasonal,Steady Growth
patriotic fake tattoos,9,Steady Decreasing,Slowing Growth
paw print fake tattoo,5,Seasonal,Slowing Growth
pca lip plumper,0,Seasonal,Slowing Growth
peace sign fake tattoos,9,Steady Decreasing,Steady Decreasing
peach bellini elf lip gloss,2,Seasonal,Slowing Growth
peach bellini lip gloss,2,Seasonal,Slowing Growth
peach color lip gloss,2,Seasonal,Seasonal
peach gloss,12,Seasonal,Seasonal
peach lip gloss,2,Seasonal,Steady Growth
peaches and cream gloss,12,Seasonal,Steady Decreasing
peaches and cream lipgloss,38,Seasonal,Seasonal
peel and reveal lip color,49,Slowing Growth,Steady Growth
peel and reveal lip stain,49,Slowing Growth,Slowing Growth
peel off lip stain wonderskin,65,Slowing Growth,Slowing Growth
pencil lip gloss,2,Seasonal,Steady Growth
pencil lip gloss tubes,20,Seasonal,Steady Growth
pepper lip plumper,0,Seasonal,Steady Decreasing
peppermint essential oil lip plumper,0,Seasonal,Steady Decreasing
peppermint lip gloss,2,Seasonal,Seasonal
peppermint lip plumper,0,Seasonal,Seasonal
peppermint oil lip plumper,0,Seasonal,Seasonal
perfect plump lips,11,Steady Growth,Seasonal
perfect tone lip gloss,2,Seasonal,Seasonal
perfume temporary tattoo tiktok,22,Seasonal,Slowing Growth
permanent fake freckles,81,Seasonal,Seasonal
permanent lip gloss,2,Seasonal,Seasonal
permanent lip plumper,0,Seasonal,Slowing Growth
permanent lip plumping at home,59,Seasonal,Slowing Growth
persona lip gloss,2,Seasonal,Steady Growth
persona lip gloss toffee,2,Seasonal,Steady Growth
persona toffee lip gloss,2,Seasonal,Steady Growth
personal fake tattoos,9,Steady Decreasing,Slowing Growth
personalised fake tattoo,5,Seasonal,Slowing Growth
personalised lip gloss,2,Seasonal,Slowing Growth
personalised lip gloss tubes,20,Seasonal,Slowing Growth
personalized fake tattoos,9,Steady Decreasing,Seasonal
personalized lip gloss,2,Seasonal,Seasonal
personalized lip gloss tubes,20,Seasonal,Seasonal
petite n pretty lip gloss,2,Seasonal,Steady Growth
ph lip gloss,2,Seasonal,Seasonal
phantom troupe fake tattoo,5,Seasonal,Stable
phat lip gloss,2,Seasonal,Steady Growth
philosophy lip gloss,2,Seasonal,Seasonal
physicians formula diamond lip plumper,80,Seasonal,Slowing Growth
physicians formula diamond plumper,80,Seasonal,Steady Growth
physicians formula lip plumper,80,Seasonal,Slowing Growth
physicians formula mineral wear diamond glow lip plumper,80,Seasonal,Steady Growth
physicians formula plumper,80,Seasonal,Seasonal
physicians formula plumping lip gloss,15,Seasonal,Slowing Growth
pictures of fake tattoos,9,Steady Decreasing,Seasonal
pigmented lip gloss,2,Seasonal,Seasonal
pillow plump gloss,12,Seasonal,Seasonal
pillow plump lip gloss,73,Seasonal,Seasonal
pillow plump lip gloss soap and glory,34,Seasonal,Slowing Growth
pillow plump lip gloss target,73,Seasonal,Steady Decreasing
pillow plump lip gloss xxl,73,Seasonal,Seasonal
pillow plump lip gloss xxl precio,73,Seasonal,Slowing Growth
pillow plump soap and glory lip gloss,34,Seasonal,Slowing Growth
pillow plump xxl lip gloss soap and glory,34,Seasonal,Slowing Growth
pillow talk lip gloss,2,Seasonal,Seasonal
pillow talk lip plumper,0,Seasonal,Seasonal
pineapple fake tattoo,5,Seasonal,Steady Decreasing
pineapple lip gloss,2,Seasonal,Seasonal
pink clear lip gloss,16,Steady Decreasing,Seasonal
pink cosmo lip gloss,2,Seasonal,Slowing Growth
pink euphoria makeup,4,Steady Growth,Steady Growth
pink euphoria makeup look,4,Steady Growth,Steady Growth
pink glitter lip gloss,2,Seasonal,Seasonal
pink ice lip plumper,0,Seasonal,Slowing Growth
pink lady buxom lip gloss,7,Seasonal,Slowing Growth
pink lemonade lip gloss,2,Seasonal,Seasonal
pink lip gloss,36,Seasonal,Seasonal
pink lip gloss for dark skin,36,Seasonal,Seasonal
pink lip plumper,0,Seasonal,Seasonal
pink lip plumping gloss,14,Seasonal,Slowing Growth
pink paw print temporary tattoos,8,Seasonal,Slowing Growth
pink plumping lip gloss,15,Seasonal,Slowing Growth
pink punch lip injection,53,Slowing Growth,Slowing Growth
pink salad lip gloss,2,Seasonal,Steady Growth
pink shimmer lip gloss,2,Seasonal,Seasonal
pink tinted lip gloss,2,Seasonal,Seasonal
pinpoxe lip plumper,0,Seasonal,Slowing Growth
pinterest euphoria makeup,4,Steady Growth,Slowing Growth
pipmine lip gloss,2,Seasonal,Steady Growth
pixi by petra lip gloss,2,Seasonal,Seasonal
pixi by petra lip plumper,0,Seasonal,Seasonal
pixi collagen lip gloss,2,Seasonal,Steady Growth
pixi lip gloss,2,Seasonal,Seasonal
pixi lip plumper,0,Seasonal,Seasonal
pixi liplift max lip plumper,0,Seasonal,Slowing Growth
pixi plumping gloss,96,Seasonal,Slowing Growth
places that sell fake tattoos,9,Steady Decreasing,Slowing Growth
places that sell temporary tattoos,8,Seasonal,Seasonal
places to buy fake tattoos,9,Steady Decreasing,Slowing Growth
places to get fake tattoos,9,Steady Decreasing,Seasonal
places to get fake tattoos near me,9,Steady Decreasing,Slowing Growth
plain lip gloss,2,Seasonal,Seasonal
plastic lip plumper,0,Seasonal,Seasonal
platinum lip plump,57,Slowing Growth,Seasonal
platinum lip plump dr devgan,57,Slowing Growth,Steady Growth
platinum lip plump lara devgan,57,Slowing Growth,Slowing Growth
plenty of pout plumping lip gloss,15,Seasonal,Steady Growth
plenty of pout plumping lip gloss mac,15,Seasonal,Slowing Growth
plum lip gloss,2,Seasonal,Seasonal
plump and gloss,12,Seasonal,Slowing Growth
plump and shine lip gloss,19,Seasonal,Steady Decreasing
plump full lips,11,Steady Growth,Seasonal
plump gloss la colors,12,Seasonal,Stable
plump glossy lips,11,Steady Growth,Seasonal
plump in gloss,12,Seasonal,Slowing Growth
plump it lip gloss,2,Seasonal,Seasonal
plump it lipgloss,38,Seasonal,Slowing Growth
plump it up lip gloss,99,Slowing Growth,Seasonal
plump lip filler,31,Seasonal,Steady Growth
plump lip maximizer,53,Slowing Growth,Slowing Growth
plump lip plumper,0,Seasonal,Slowing Growth
plump lips hyaluronic acid,11,Steady Growth,Slowing Growth
plump lips no fillers,11,Steady Growth,Slowing Growth
plump lips too faced,27,Seasonal,Slowing Growth
plump lips without filler,11,Steady Growth,Seasonal
plump me up extreme lip plumper,72,Slowing Growth,Slowing Growth
plump me up lip gloss,99,Slowing Growth,Steady Growth
plump me up lip gloss collection,99,Slowing Growth,Slowing Growth
plump me up lip gloss victoria secret,99,Slowing Growth,Slowing Growth
plump me up lip plumper,99,Slowing Growth,Slowing Growth
plump me up victoria secret,99,Slowing Growth,Steady Decreasing
plump my lips,11,Steady Growth,Seasonal
plump natural lips,11,Steady Growth,Slowing Growth
plump on lip balm,53,Slowing Growth,Steady Decreasing
plump potion lip gloss,2,Seasonal,Seasonal
plump pout lip gloss,2,Seasonal,Seasonal
plump pouty lips,11,Steady Growth,Slowing Growth
plump too faced,27,Seasonal,Slowing Growth
plump up lip balm,53,Slowing Growth,Slowing Growth
plump up lip gloss,99,Slowing Growth,Seasonal
plump up the volume lip gloss,2,Seasonal,Slowing Growth
plump up your lips,11,Steady Growth,Seasonal
plump your lips,11,Steady Growth,Seasonal
plump your pucker lip gloss,40,Slowing Growth,Seasonal
plumped up lips,11,Steady Growth,Steady Decreasing
plumped up pout lip gloss,2,Seasonal,Slowing Growth
plumped up pout lip plumper,0,Seasonal,Slowing Growth
plumper,83,Seasonal,Fast Decreasing
plumper black,83,Seasonal,Steady Growth
plumper extreme lip gloss,72,Slowing Growth,Slowing Growth
plumper holika holika,83,Seasonal,Slowing Growth
plumper please,83,Seasonal,Slowing Growth
plumper please lip sculptor maybelline,83,Seasonal,Steady Decreasing
plumper sephora,83,Seasonal,Steady Decreasing
plumpers world,11,Steady Growth,Seasonal
plumping effect lip gloss,2,Seasonal,Slowing Growth
plumping gloss,96,Seasonal,Seasonal
plumping gloss essence,96,Seasonal,Slowing Growth
plumping lip color,78,Slowing Growth,Seasonal
plumping lip gloss,15,Seasonal,Seasonal
plumping lip gloss amazon,15,Seasonal,Slowing Growth
plumping lip gloss barry m,15,Seasonal,Slowing Growth
plumping lip gloss best,15,Seasonal,Steady Decreasing
plumping lip gloss buxom,15,Seasonal,Slowing Growth
plumping lip gloss cheap,15,Seasonal,Slowing Growth
plumping lip gloss clear,15,Seasonal,Seasonal
plumping lip gloss colourpop,15,Seasonal,Slowing Growth
plumping lip gloss dior,15,Seasonal,Slowing Growth
plumping lip gloss dm,15,Seasonal,Steady Decreasing
plumping lip gloss elf,15,Seasonal,Slowing Growth
plumping lip gloss essence,15,Seasonal,Slowing Growth
plumping lip gloss hard candy,15,Seasonal,Slowing Growth
plumping lip gloss mac,15,Seasonal,Slowing Growth
plumping lip gloss meaning,15,Seasonal,Slowing Growth
plumping lip gloss nyx,15,Seasonal,Slowing Growth
plumping lip gloss revolution,15,Seasonal,Slowing Growth
plumping lip gloss target,15,Seasonal,Steady Growth
plumping lip gloss that actually works,15,Seasonal,Seasonal
plumping lip gloss too faced,15,Seasonal,Slowing Growth
plumping lip gloss ulta,15,Seasonal,Seasonal
plumping lip primer,53,Slowing Growth,Seasonal
plumping lipgloss,38,Seasonal,Seasonal
plumping lipgloss essence,38,Seasonal,Steady Decreasing
plumping nudes,11,Steady Growth,Slowing Growth
plumping nudes essence,11,Steady Growth,Slowing Growth
plumping nudes lipgloss,38,Seasonal,Slowing Growth
plumping nudes lipgloss essence,38,Seasonal,Slowing Growth
plumping serum for lips,11,Steady Growth,Slowing Growth
plumping serum lip gloss,91,Steady Decreasing,Seasonal
plumping serum lip gloss hard candy,91,Steady Decreasing,Steady Decreasing
plumping serum volumizing lip gloss,91,Steady Decreasing,Seasonal
plumprageous,11,Steady Growth,Seasonal
pmd beauty kiss lip plumping system,59,Seasonal,Slowing Growth
pmd beauty lip plumper,0,Seasonal,Seasonal
pmd kiss lip plumping system,59,Seasonal,Seasonal
pmd lip plumper,0,Seasonal,Seasonal
pmd lip plumping system,59,Seasonal,Seasonal
pocahontas fake tattoo,5,Seasonal,Slowing Growth
poisonous pout plumping lipgloss,38,Seasonal,Slowing Growth
polynesian fake tattoo,5,Seasonal,Steady Decreasing
pop beauty plump pout lip gloss,2,Seasonal,Slowing Growth
pop gloss,12,Seasonal,Seasonal
pop lip gloss,2,Seasonal,Seasonal
pop splash lip gloss,2,Seasonal,Steady Decreasing
popsicle lip gloss,2,Seasonal,Seasonal
popular lip gloss,2,Seasonal,Seasonal
popular lip plumper,0,Seasonal,Seasonal
post malone face tattoos fake,47,Seasonal,Steady Decreasing
post malone fake face tattoos,47,Seasonal,Steady Decreasing
post malone fake tattoos,9,Steady Decreasing,Seasonal
post malone fake tattoos for sale,9,Steady Decreasing,Steady Decreasing
post malone tattoos fake,47,Seasonal,Fast Decreasing
postbiotic skincare,11,Steady Growth,Slowing Growth
pound of flesh fake skin,81,Seasonal,Slowing Growth
pout bomb lip gloss,2,Seasonal,Slowing Growth
pout bomb lip plumper,0,Seasonal,Slowing Growth
pout bomb maxi plump lip gloss,73,Seasonal,Slowing Growth
pout bomb maxi plumping gloss,96,Seasonal,Steady Growth
pout bomb plumping gloss,13,Steady Growth,Steady Growth
pout bomb plumping gloss kiss,13,Steady Growth,Slowing Growth
pout bomb plumping gloss lipgloss,13,Steady Growth,Slowing Growth
pout bomb plumping gloss revolution,13,Steady Growth,Slowing Growth
pout bomb plumping lip gloss,15,Seasonal,Stable
pout lip gloss,2,Seasonal,Seasonal
pout lip plumper,0,Seasonal,Slowing Growth
pout plumping gloss,96,Seasonal,Slowing Growth
pout plumping lip gloss,15,Seasonal,Seasonal
pouty lipzz plumping lip gloss,15,Seasonal,Slowing Growth
power plumping lip gloss,15,Seasonal,Slowing Growth
powerglass plumping lip gloss,15,Seasonal,Steady Growth
powerglass plumping lip gloss mac,15,Seasonal,Slowing Growth
powerglass plumping lipgloss,38,Seasonal,Slowing Growth
praline butter gloss,61,Steady Growth,Seasonal
praline butter gloss nyx,61,Steady Growth,Seasonal
praline lip gloss,2,Seasonal,Seasonal
premade lip gloss,2,Seasonal,Steady Growth
pretend sleeve tattoos,71,Seasonal,Steady Decreasing
pretty beauty lip plumper,0,Seasonal,Stable
pretty fake tattoos,9,Steady Decreasing,Seasonal
pretty lip gloss,2,Seasonal,Seasonal
pretty lip plumper,0,Seasonal,Slowing Growth
pretty plump lips,11,Steady Growth,Slowing Growth
pretty vulgar lip gloss,2,Seasonal,Seasonal
pretty vulgar poisonous pout plumping lipgloss,38,Seasonal,Slowing Growth
pretty woman lip gloss,2,Seasonal,Slowing Growth
pride fake tattoos,9,Steady Decreasing,Steady Decreasing
print my own temporary tattoos,8,Seasonal,Slowing Growth
print on demand temporary tattoos,8,Seasonal,Slowing Growth
print out temporary tattoos,8,Seasonal,Steady Decreasing
print own temporary tattoos,8,Seasonal,Steady Decreasing
print your own fake tattoos,9,Steady Decreasing,Steady Decreasing
print your own temporary tattoos,8,Seasonal,Seasonal
printable fake tattoo,5,Seasonal,Slowing Growth
printable fake tattoo paper,5,Seasonal,Slowing Growth
printed lip gloss tubes,20,Seasonal,Steady Growth
printer ink temporary tattoo,22,Seasonal,Slowing Growth
prismatic peach milani,11,Steady Growth,Slowing Growth
prison tattoos fake,71,Seasonal,Stable
private label lip gloss,2,Seasonal,Steady Growth
private label lip plumper,0,Seasonal,Seasonal
private label vegan lip gloss,2,Seasonal,Steady Growth
products for fuller lips,11,Steady Growth,Seasonal
products that make your lips bigger,11,Steady Growth,Seasonal
products to make lip gloss,2,Seasonal,Steady Growth
products to make lips bigger,11,Steady Growth,Seasonal
proedit lip plumper,0,Seasonal,Stable
professional fake tattoos,9,Steady Decreasing,Seasonal
professional lip plumper,0,Seasonal,Seasonal
profusion lip gloss,2,Seasonal,Seasonal
project lip lip plumper,0,Seasonal,Slowing Growth
project lip plumper,0,Seasonal,Seasonal
project lip plumping kit,59,Seasonal,Slowing Growth
ps lip plumper,0,Seasonal,Slowing Growth
pucker lip gloss,2,Seasonal,Seasonal
pucker pops lip gloss,2,Seasonal,Seasonal
pucker up lip gloss,99,Slowing Growth,Seasonal
pudaier lip gloss,2,Seasonal,Seasonal
pump lip gloss,2,Seasonal,Seasonal
pump up lip gloss,99,Slowing Growth,Seasonal
pump up your lips,11,Steady Growth,Slowing Growth
pumpkin lip gloss,2,Seasonal,Seasonal
pumpkin spice lip gloss,2,Seasonal,Seasonal
punk rock temporary tattoos,8,Seasonal,Steady Decreasing
pur lip gloss,2,Seasonal,Seasonal
pure color envy lip gloss,2,Seasonal,Slowing Growth
pure lip gloss,2,Seasonal,Seasonal
purple euphoria makeup,4,Steady Growth,Steady Growth
purple lip gloss,2,Seasonal,Steady Growth
px look cosmetics lip gloss,2,Seasonal,Steady Growth
pyt beauty lip plumper,0,Seasonal,Slowing Growth
pyt beauty plumping lip gloss,15,Seasonal,Steady Growth
pyt lip gloss,2,Seasonal,Steady Growth
pyt lip plumper,0,Seasonal,Steady Growth
pyt plumping lip gloss,15,Seasonal,Steady Growth
qibest lip gloss,2,Seasonal,Steady Growth
qr code fake tattoo,5,Seasonal,Stable
quality fake tattoos,9,Steady Decreasing,Seasonal
quality temporary tattoos for adults,8,Seasonal,Slowing Growth
queen lip plumper,0,Seasonal,Steady Growth
queen lipstick lip plumper,0,Seasonal,Slowing Growth
queen of spades fake tattoo,5,Seasonal,Slowing Growth
quo lip gloss,2,Seasonal,Slowing Growth
rachel lip gloss,2,Seasonal,Slowing Growth
radiant lip gloss,2,Seasonal,Seasonal
rainbow fake tattoo,5,Seasonal,Slowing Growth
rainbow lip gloss,2,Seasonal,Seasonal
rainbow sugar lip gloss,2,Seasonal,Seasonal
rainbow sugar tasty lip gloss,2,Seasonal,Slowing Growth
rare beauty lipgloss,38,Seasonal,Steady Growth
raspberry lip gloss,2,Seasonal,Seasonal
real fake tattoos,9,Steady Decreasing,Seasonal
real life fake tattoos,9,Steady Decreasing,Slowing Growth
real lip plumper,0,Seasonal,Seasonal
real looking temporary tattoo sleeves,21,Seasonal,Slowing Growth
real tattoo temporary ink,22,Seasonal,Slowing Growth
realher lip gloss,2,Seasonal,Seasonal
realistic eye temporary tattoo,22,Seasonal,Steady Decreasing
realistic fake neck tattoos,71,Seasonal,Steady Growth
realistic fake tattoo sleeve,98,Seasonal,Seasonal
realistic fake tattoos,9,Steady Decreasing,Accelerated Growth
realistic fake tattoos amazon,9,Steady Decreasing,Slowing Growth
realistic fake tattoos for adults,9,Steady Decreasing,Slowing Growth
realistic long lasting temporary tattoos,8,Seasonal,Seasonal
realistic looking fake tattoos,9,Steady Decreasing,Seasonal
realistic looking temporary tattoos,8,Seasonal,Seasonal
realistic scar tattoo,81,Seasonal,Seasonal
realistic temporary sleeve tattoos,8,Seasonal,Seasonal
realistic temporary tattoos,8,Seasonal,Steady Growth
realistic temporary tattoos custom,8,Seasonal,Slowing Growth
realistic temporary tattoos for adults,8,Seasonal,Steady Decreasing
realistic temporary tattoos near me,79,Seasonal,Slowing Growth
realistic temporary tattoos sleeve,8,Seasonal,Slowing Growth
realistic wound tattoo,81,Seasonal,Steady Growth
really good fake tattoos,9,Steady Decreasing,Slowing Growth
really good lip plumper,0,Seasonal,Seasonal
rebecca lip gloss,2,Seasonal,Steady Growth
red dragon fake tattoo,5,Seasonal,Slowing Growth
red dragon temporary tattoo,22,Seasonal,Steady Growth
red euphoria makeup,4,Steady Growth,Steady Growth
red fake tattoo,5,Seasonal,Slowing Growth
red glitter lip gloss,2,Seasonal,Seasonal
red ink temporary tattoo,22,Seasonal,Steady Growth
red lip gloss,2,Seasonal,Accelerated Growth
red lip plumper,0,Seasonal,Seasonal
red lip plumper gloss,84,Slowing Growth,Stable
red plumping lip gloss,15,Seasonal,Slowing Growth
red tinted lip gloss,2,Seasonal,Seasonal
rejawece lip plumper,0,Seasonal,Slowing Growth
remi rose lip gloss,2,Seasonal,Steady Growth
removable tattoo sleeves,58,Steady Growth,Steady Growth
restoring skin microbiome,11,Steady Growth,Slowing Growth
reviews on wonderskin,23,Slowing Growth,Slowing Growth
revlon 203 lip gloss,2,Seasonal,Steady Growth
revlon clear lip gloss,16,Steady Decreasing,Seasonal
revlon colorburst lip gloss,2,Seasonal,Seasonal
revlon colorstay lip gloss,2,Seasonal,Seasonal
revlon gloss,12,Seasonal,Steady Growth
revlon lip gloss,2,Seasonal,Steady Decreasing
revlon lip gloss clear,2,Seasonal,Steady Growth
revlon lip plumper,0,Seasonal,Seasonal
revlon lustrous lip gloss,2,Seasonal,Seasonal
revlon matte lipgloss,38,Seasonal,Seasonal
revlon rose quartz lip gloss,2,Seasonal,Steady Growth
revlon rosy future lip gloss,2,Seasonal,Seasonal
revlon super lustrous gloss,12,Seasonal,Seasonal
revlon super lustrous lip gloss,2,Seasonal,Steady Decreasing
revlon super lustrous lip gloss rosy future,2,Seasonal,Seasonal
revlon super lustrous lip gloss super natural,2,Seasonal,Seasonal
revlon super lustrous the gloss,12,Seasonal,Steady Growth
revlon super natural lip gloss,2,Seasonal,Seasonal
revlon the gloss,12,Seasonal,Steady Growth
revolution bomb gloss,12,Seasonal,Stable
revolution bomb lip gloss,44,Seasonal,Slowing Growth
revolution bratz collection lip gloss,44,Seasonal,Slowing Growth
revolution bratz lip gloss,44,Seasonal,Slowing Growth
revolution chocolate lip gloss,2,Seasonal,Slowing Growth
revolution clear lip gloss,16,Steady Decreasing,Slowing Growth
revolution cookie lip gloss,2,Seasonal,Slowing Growth
revolution euphoria,95,Slowing Growth,Slowing Growth
revolution gloss flushed,12,Seasonal,Slowing Growth
revolution hydra bomb lip gloss,44,Seasonal,Slowing Growth
revolution hydra gloss,12,Seasonal,Steady Growth
revolution juicy bomb lip gloss,44,Seasonal,Slowing Growth
revolution lip gloss,44,Seasonal,Seasonal
revolution lip gloss bratz,44,Seasonal,Slowing Growth
revolution lip gloss flushed,44,Seasonal,Slowing Growth
revolution lip gloss set,10,Seasonal,Slowing Growth
revolution lip plumper,0,Seasonal,Steady Growth
revolution lip plumper gloss,84,Slowing Growth,Slowing Growth
revolution lip plumping gloss,14,Seasonal,Slowing Growth
revolution makeup bratz lip gloss,44,Seasonal,Slowing Growth
revolution plumping lip gloss,15,Seasonal,Steady Growth
revolution plumping lip gloss kiss,15,Seasonal,Slowing Growth
revolution pout bomb gloss,13,Steady Growth,Slowing Growth
revolution pout bomb lip gloss,44,Seasonal,Steady Growth
revolution pout bomb maxi plumping lip gloss,15,Seasonal,Slowing Growth
revolution pout bomb plumping gloss juicy,13,Steady Growth,Slowing Growth
revolution pout bomb plumping gloss kiss,13,Steady Growth,Slowing Growth
revolution pout bomb plumping gloss peachy,13,Steady Growth,Slowing Growth
revolution pout bomb plumping lip gloss,13,Steady Growth,Steady Growth
revolution pro hydra gloss flushed,12,Seasonal,Steady Growth
revolution pro hydra lip gloss,2,Seasonal,Slowing Growth
revolution pro lip gloss,2,Seasonal,Slowing Growth
revolution reloaded euphoria,95,Slowing Growth,Slowing Growth
revolution sheer brilliant lip gloss,2,Seasonal,Slowing Growth
revolution sheer lip gloss,2,Seasonal,Slowing Growth
revolution x bratz lip gloss,44,Seasonal,Slowing Growth
revolution x bratz maxi plump lip gloss,73,Seasonal,Slowing Growth
revox lip plumper,0,Seasonal,Slowing Growth
rhinestone lip gloss tubes,20,Seasonal,Steady Growth
rhinestone makeup euphoria,70,Steady Growth,Steady Growth
rich & dazzling lip gloss,2,Seasonal,Steady Growth
rihanna fenty beauty lip gloss,86,Seasonal,Seasonal
rihanna fenty lip gloss,42,Seasonal,Seasonal
rihanna lip gloss,2,Seasonal,Seasonal
rihanna lip gloss set,10,Seasonal,Steady Growth
rimmel clear lip gloss,16,Steady Decreasing,Seasonal
rimmel lip gloss,2,Seasonal,Steady Decreasing
rimmel lip gloss colors,2,Seasonal,Seasonal
rimmel lip plumper,0,Seasonal,Slowing Growth
rimmel london gloss,12,Seasonal,Seasonal
rimmel london lip gloss,2,Seasonal,Steady Decreasing
rimmel london oh my gloss lip gloss,2,Seasonal,Steady Decreasing
rimmel london stay glossy lip gloss,2,Seasonal,Seasonal
rimmel plumping lip gloss,15,Seasonal,Slowing Growth
rimmel snog lip gloss,2,Seasonal,Steady Decreasing
rimmel stay glossy lip gloss,2,Seasonal,Seasonal
rivaj lip gloss,2,Seasonal,Slowing Growth
rival loves me stay4ever lipgloss,38,Seasonal,Slowing Growth
rival me lip gloss,2,Seasonal,Stable
rk by kiss lip gloss,2,Seasonal,Seasonal
rk lip gloss,2,Seasonal,Seasonal
rmk lip gloss,2,Seasonal,Seasonal
robin mcgraw lip gloss,2,Seasonal,Seasonal
roll on fruity lip gloss,2,Seasonal,Seasonal
roll on lip gloss,2,Seasonal,Accelerated Growth
roll on lip gloss 90s,2,Seasonal,Steady Growth
roll on lip gloss tubes,20,Seasonal,Steady Growth
roller ball lip gloss 80s,2,Seasonal,Steady Growth
roller lipgloss,38,Seasonal,Seasonal
rollerball lip gloss,2,Seasonal,Seasonal
rollerball lip gloss 90s,2,Seasonal,Slowing Growth
rolling stones fake tattoos,9,Steady Decreasing,Slowing Growth
roman numeral fake tattoos,9,Steady Decreasing,Slowing Growth
roman reigns fake tattoo,5,Seasonal,Slowing Growth
romand lip gloss,2,Seasonal,Steady Growth
romantic beauty lip gloss,86,Seasonal,Slowing Growth
romantic beauty matte lip gloss,97,Seasonal,Slowing Growth
romantic beauty professional matte lip gloss,97,Seasonal,Slowing Growth
romantic bird lip gloss,2,Seasonal,Slowing Growth
romantic may lip gloss,2,Seasonal,Steady Growth
romantic may matte lip gloss,97,Seasonal,Slowing Growth
rose all day lip gloss,2,Seasonal,Slowing Growth
rose gold lip gloss,2,Seasonal,Steady Decreasing
rose gold lip gloss tubes,20,Seasonal,Steady Growth
rose lip gloss,2,Seasonal,Seasonal
rose oil lip gloss,2,Seasonal,Seasonal
rose stream lip gloss,2,Seasonal,Steady Growth
rose tattoo fake,81,Seasonal,Slowing Growth
rose temporary tattoo,22,Seasonal,Steady Decreasing
rosehip lip gloss,2,Seasonal,Seasonal
rosehip oil lip gloss,2,Seasonal,Seasonal
rossy lip plumper,0,Seasonal,Slowing Growth
rouge coco gloss,12,Seasonal,Seasonal
rouge coco gloss 119,12,Seasonal,Seasonal
rouge coco gloss 722,12,Seasonal,Seasonal
rude berry juicy lip gloss,75,Seasonal,Steady Growth
rude cosmetics lip gloss,2,Seasonal,Slowing Growth
rude lip gloss,2,Seasonal,Slowing Growth
rudolph care lip gloss,2,Seasonal,Slowing Growth
rue carnival makeup,11,Steady Growth,Steady Growth
rue euphoria eye makeup,70,Steady Growth,Steady Growth
rue euphoria glitter,32,Steady Growth,Steady Growth
rue euphoria glitter tears,32,Steady Growth,Stable
rue euphoria make up,24,Slowing Growth,Stable
rue euphoria makeup,4,Steady Growth,Accelerated Growth
rue euphoria makeup glitter,4,Steady Growth,Steady Growth
rue euphoria makeup looks,52,Steady Growth,Steady Growth
rue eye makeup euphoria,70,Steady Growth,Slowing Growth
rue from euphoria makeup,4,Steady Growth,Steady Growth
rue glitter makeup,32,Steady Growth,Slowing Growth
rue glitter makeup euphoria,32,Steady Growth,Steady Growth
rue glitter tears,32,Steady Growth,Steady Growth
rue halloween makeup,11,Steady Growth,Slowing Growth
