entity,cluster,cluster_category,entity_categories
$1 lip gloss,2,Seasonal,Seasonal
02 night marine lip gloss,2,Seasonal,Slowing Growth
08 rose stream lip gloss,2,Seasonal,Steady Growth
1 dollar lip gloss,2,Seasonal,Seasonal
10ml lip gloss tubes,20,Seasonal,Steady Growth
10ml lip gloss wand tubes,2,Seasonal,Steady Growth
15ml lip gloss tubes,20,Seasonal,Seasonal
2 faced injection lip gloss,69,Seasonal,Slowing Growth
2 faced lip gloss,2,Seasonal,Seasonal
2 faced lip injection,3,Steady Growth,Seasonal
2 faced lip injection extreme,26,Seasonal,Seasonal
2 faced lip injection extreme gloss,26,Seasonal,Slowing Growth
2 faced lip injection gloss,3,Steady Growth,Steady Growth
2 faced lip injection lip gloss,69,Seasonal,Seasonal
2 faced lip plumper,56,Seasonal,Seasonal
2 faced lip plumping gloss,14,Seasonal,Slowing Growth
2 faced plumping lip gloss,15,Seasonal,Slowing Growth
2 in 1 lipstick lip gloss,2,Seasonal,Steady Decreasing
20 sheets fake black tiny temporary tattoo body sticker hand neck wrist art fashion,22,Seasonal,Slowing Growth
2000s lip gloss,2,Seasonal,Seasonal
2021 best lip plumper,76,Seasonal,Slowing Growth
24 hour lip gloss,2,Seasonal,Seasonal
24 karat lip gloss bare minerals,2,Seasonal,Steady Decreasing
24k gold lip gloss,2,Seasonal,Seasonal
24k lip gloss,2,Seasonal,Seasonal
3 month temporary tattoos,8,Seasonal,Steady Decreasing
3ce lip gloss,2,Seasonal,Seasonal
3d fake tattoos,9,Steady Decreasing,Slowing Growth
3d hydra lipgloss,38,Seasonal,Seasonal
3d lip gloss,2,Seasonal,Seasonal
3d lip gloss enhancer with maximum volume,2,Seasonal,Slowing Growth
3d lip gloss lip enhancer,2,Seasonal,Slowing Growth
3d lip gloss lip enhancer with maximise volume,2,Seasonal,Steady Growth
3d lip gloss lip enhancer with maximize volume,2,Seasonal,Slowing Growth
3d lip gloss lip enhancer with maximum volume,2,Seasonal,Slowing Growth
3d lip plumper,0,Seasonal,Seasonal
3d lip plumper lip gloss,0,Seasonal,Slowing Growth
3d lipgloss lip enhancer with maximise volume,53,Slowing Growth,Steady Growth
3d plumping lip gloss,15,Seasonal,Slowing Growth
3d temporary tattoo sticker,22,Seasonal,Slowing Growth
3d temporary tattoos,8,Seasonal,Seasonal
42 sheets temporary tattoos for men and women fake tattoo body art sticker,8,Seasonal,Slowing Growth
4th of july fake tattoos,9,Steady Decreasing,Steady Decreasing
5ml lip gloss tubes,20,Seasonal,Steady Growth
6 month temporary tattoos,8,Seasonal,Seasonal
69 fake face tattoos,47,Seasonal,Steady Decreasing
69 fake tattoos,9,Steady Decreasing,Steady Decreasing
69 tattoos fake,71,Seasonal,Steady Decreasing
6ix9ine fake tattoo,5,Seasonal,Steady Decreasing
70s lip gloss,2,Seasonal,Seasonal
80s lip gloss,2,Seasonal,Steady Growth
90s lip gloss,2,Seasonal,Seasonal
a fake tattoo,5,Seasonal,Seasonal
a fake tattoo look real,5,Seasonal,Slowing Growth
a good lip plumper,0,Seasonal,Seasonal
a pound of flesh fake skin,81,Seasonal,Slowing Growth
a temporary tattoo,22,Seasonal,Seasonal
abh lip gloss,2,Seasonal,Seasonal
abh lip gloss set,10,Seasonal,Seasonal
abh toffee lip gloss,2,Seasonal,Seasonal
adam levine fake tattoos,9,Steady Decreasing,Steady Decreasing
adult fake tattoos,9,Steady Decreasing,Steady Growth
advanced nutrition skin biome,11,Steady Growth,Slowing Growth
aesthetic fake tattoos,9,Steady Decreasing,Slowing Growth
affordable lip gloss,2,Seasonal,Seasonal
affordable lip plumper,0,Seasonal,Seasonal
ageless lip plumper,0,Seasonal,Steady Growth
ageless lip plumper with volulip,0,Seasonal,Slowing Growth
agelyss lip plumper,0,Seasonal,Steady Growth
agelyss lip plumper amazon,0,Seasonal,Slowing Growth
agelyss lip plumper with volulip,0,Seasonal,Steady Growth
alexa demie blue eyeshadow,11,Steady Growth,Steady Growth
alexa demie euphoria makeup,4,Steady Growth,Steady Growth
alexa demie euphoria makeup looks,52,Steady Growth,Steady Growth
alexa demie eye makeup,70,Steady Growth,Steady Growth
alexa demie eyeliner,11,Steady Growth,Steady Growth
alexa demie eyeshadow,11,Steady Growth,Steady Growth
alexa demie green eyeshadow,11,Steady Growth,Stable
alexa demie lip liner,53,Slowing Growth,Slowing Growth
alexa demie mac cosmetics,11,Steady Growth,Steady Growth
alexa demie mac makeup,11,Steady Growth,Steady Growth
alexa demie make up,24,Slowing Growth,Slowing Growth
alexa demie makeup,11,Steady Growth,Accelerated Growth
alexa demie makeup euphoria,70,Steady Growth,Steady Growth
alexa demie makeup looks,60,Steady Growth,Steady Growth
alexa demie makeup products,11,Steady Growth,Slowing Growth
alexa demie vogue makeup products,11,Steady Growth,Slowing Growth
alexa euphoria makeup,4,Steady Growth,Steady Growth
alibaba lip gloss,2,Seasonal,Steady Growth
alice in wonderland fake tattoos,9,Steady Decreasing,Slowing Growth
aliexpress lip gloss,2,Seasonal,Seasonal
aliexpress lip gloss tubes,20,Seasonal,Steady Growth
aliexpress lip plumper,0,Seasonal,Seasonal
aliver lip plumper,0,Seasonal,Steady Growth
all day lip gloss,2,Seasonal,Seasonal
all euphoria makeup looks,52,Steady Growth,Steady Growth
all natural lip gloss,2,Seasonal,Slowing Growth
all natural lip plumper,0,Seasonal,Seasonal
all natural lip plumping gloss,14,Seasonal,Slowing Growth
all the euphoria makeup looks,52,Steady Growth,Slowing Growth
allure shine lustrous lip plumper,0,Seasonal,Slowing Growth
allure wonderskin,23,Slowing Growth,Slowing Growth
almay lip gloss,2,Seasonal,Fast Decreasing
aloe lip gloss,2,Seasonal,Seasonal
aloe vera lip gloss,2,Seasonal,Seasonal
alterra lipgloss,38,Seasonal,Slowing Growth
amanda lip gloss,2,Seasonal,Steady Decreasing
amazon best lip plumper,76,Seasonal,Slowing Growth
amazon derol,11,Steady Growth,Slowing Growth
amazon derol lip plumper,0,Seasonal,Slowing Growth
amazon fake sleeve tattoo,81,Seasonal,Slowing Growth
amazon fake tattoo skin,5,Seasonal,Slowing Growth
amazon lip gloss,2,Seasonal,Seasonal
amazon lip gloss kit,50,Seasonal,Steady Growth
amazon lip gloss tubes,20,Seasonal,Seasonal
amazon lip maximizer,53,Slowing Growth,Slowing Growth
amazon lip plumper,0,Seasonal,Seasonal
amazon lip plumper derol,0,Seasonal,Slowing Growth
amazon lip plumper tiktok,0,Seasonal,Slowing Growth
amazon lip plumping gloss,14,Seasonal,Slowing Growth
amazon plumping lip gloss,15,Seasonal,Slowing Growth
amazon tattoo fake,81,Seasonal,Slowing Growth
amazon wonderskin,23,Slowing Growth,Slowing Growth
among us tattoo fake,81,Seasonal,Slowing Growth
amuse lip gloss,2,Seasonal,Seasonal
amway lip gloss,2,Seasonal,Seasonal
anastasia beverly hills diamond lip gloss,2,Seasonal,Slowing Growth
anastasia beverly hills gloss,12,Seasonal,Seasonal
anastasia beverly hills kristen lip gloss,2,Seasonal,Seasonal
anastasia beverly hills lip gloss,2,Seasonal,Seasonal
anastasia beverly hills lip gloss moon jelly,2,Seasonal,Seasonal
anastasia beverly hills lip gloss set,10,Seasonal,Seasonal
anastasia beverly hills lip plumper,0,Seasonal,Seasonal
anastasia beverly hills mini lip gloss set,10,Seasonal,Seasonal
anastasia beverly hills moon jelly lip gloss,2,Seasonal,Seasonal
anastasia beverly hills st tropez lip gloss,2,Seasonal,Seasonal
anastasia beverly hills toffee lip gloss,2,Seasonal,Seasonal
anastasia beverly hills vintage lip gloss,2,Seasonal,Seasonal
anastasia kristen lip gloss,2,Seasonal,Seasonal
anastasia lip gloss,2,Seasonal,Seasonal
anastasia lip gloss moon jelly,2,Seasonal,Seasonal
anastasia lip gloss set,10,Seasonal,Seasonal
anastasia lip plumping gloss,14,Seasonal,Slowing Growth
anastasia mini lip gloss set,10,Seasonal,Seasonal
anastasia st tropez lip gloss,2,Seasonal,Seasonal
anastasia toffee lip gloss,2,Seasonal,Seasonal
anastasia vintage lip gloss,2,Seasonal,Seasonal
anew lip plumping conditioner,59,Seasonal,Slowing Growth
animal print temporary tattoos,8,Seasonal,Seasonal
anime fake tattoos,9,Steady Decreasing,Steady Growth
anti aging lip plumper,0,Seasonal,Seasonal
aoa lip gloss,2,Seasonal,Seasonal
apple lip plumper,0,Seasonal,Fast Decreasing
applying fake tattoos,9,Steady Decreasing,Seasonal
applying lip gloss,2,Seasonal,Seasonal
apricot lip gloss,2,Seasonal,Seasonal
aquafina lip gloss,2,Seasonal,Seasonal
aquaman fake tattoos,9,Steady Decreasing,Slowing Growth
arbonne lip gloss,2,Seasonal,Steady Growth
aresvns,11,Steady Growth,Slowing Growth
argan oil lip gloss,2,Seasonal,Seasonal
argan oil lip plumper,0,Seasonal,Slowing Growth
argan oil sos lip plumper,0,Seasonal,Steady Growth
argan oil sos lip plumper amazon,0,Seasonal,Slowing Growth
ariana grande fake tattoos,9,Steady Decreasing,Slowing Growth
ariana grande fenty lip gloss,42,Seasonal,Steady Growth
ariana grande lip gloss,2,Seasonal,Seasonal
ariana grande mac lip gloss,2,Seasonal,Seasonal
arm fake tattoos,9,Steady Decreasing,Slowing Growth
arm tattoo fake,81,Seasonal,Slowing Growth
arm tattoo fake sleeves,81,Seasonal,Slowing Growth
armani lip gloss,2,Seasonal,Slowing Growth
armband fake tattoos,9,Steady Decreasing,Slowing Growth
artificial tattoo sleeves,58,Steady Growth,Seasonal
artist couture lip gloss,2,Seasonal,Seasonal
artistry light up lip gloss,99,Slowing Growth,Seasonal
artistry lip gloss,2,Seasonal,Fast Decreasing
asmr lip gloss,2,Seasonal,Seasonal
at home fake tattoo,5,Seasonal,Slowing Growth
at home lip plumper,0,Seasonal,Steady Growth
athia lip plumper,0,Seasonal,Slowing Growth
audacity lip gloss,2,Seasonal,Steady Growth
aura lip gloss,2,Seasonal,Seasonal
aurora glow eyeshadow euphoria,95,Slowing Growth,Slowing Growth
australis lip plumper,0,Seasonal,Steady Decreasing
avani euphoria makeup,4,Steady Growth,Slowing Growth
aveda lip gloss,2,Seasonal,Seasonal
avengers fake tattoo,5,Seasonal,Slowing Growth
avon anew lip plumper,0,Seasonal,Steady Decreasing
avon anew lip plumping conditioner,59,Seasonal,Slowing Growth
avon crave lip gloss,2,Seasonal,Slowing Growth
avon glazewear lip gloss,2,Seasonal,Seasonal
avon lip gloss,2,Seasonal,Fast Decreasing
avon lip plumper,0,Seasonal,Seasonal
avon lip plumper gloss,84,Slowing Growth,Seasonal
avon lip plumping conditioner,59,Seasonal,Slowing Growth
avon mark lip gloss,2,Seasonal,Seasonal
avon mark plump it lip gloss mauve,2,Seasonal,Stable
avon plumping lip gloss,15,Seasonal,Seasonal
avon true color glazewear lip gloss,2,Seasonal,Seasonal
avon true color lip gloss,2,Seasonal,Seasonal
avon ultra glazewear lip gloss,2,Seasonal,Seasonal
awesome fake tattoos,9,Steady Decreasing,Seasonal
axl rose fake tattoos,9,Steady Decreasing,Steady Decreasing
axl rose temporary tattoos,8,Seasonal,Seasonal
b simone beauty lip gloss,86,Seasonal,Steady Growth
b simone lip gloss,2,Seasonal,Accelerated Growth
bachelorette fake tattoos,9,Steady Decreasing,Slowing Growth
bachelorette party fake tattoos,9,Steady Decreasing,Steady Decreasing
bad ink fake tattoos,9,Steady Decreasing,Slowing Growth
baddie lip gloss,2,Seasonal,Seasonal
balance skin microbiome,11,Steady Growth,Slowing Growth
bald eagle temporary tattoo,22,Seasonal,Slowing Growth
ball lip gloss,2,Seasonal,Seasonal
balm lip gloss,2,Seasonal,Seasonal
bamboo lip gloss tubes,20,Seasonal,Steady Growth
barbed wire fake tattoo,5,Seasonal,Seasonal
barbie ferreira euphoria makeup,4,Steady Growth,Stable
bare escentuals buxom lip gloss,7,Seasonal,Seasonal
bare escentuals moxie lip gloss,33,Seasonal,Steady Decreasing
bare minerals 24 karat lip gloss,2,Seasonal,Seasonal
bare minerals buttercream lipgloss,38,Seasonal,Seasonal
bare minerals buxom lip gloss,7,Seasonal,Seasonal
bare minerals gloss balm,12,Seasonal,Steady Growth
bare minerals lip gloss,2,Seasonal,Seasonal
bare minerals lip gloss 24 karat,2,Seasonal,Slowing Growth
bare minerals lip gloss balm,2,Seasonal,Steady Growth
bare minerals lip gloss maverick,2,Seasonal,Slowing Growth
bare minerals lip gloss set,10,Seasonal,Seasonal
bare minerals lip gloss spark plug,2,Seasonal,Slowing Growth
bare minerals lip plumper,0,Seasonal,Seasonal
bare minerals lip plumping gloss,14,Seasonal,Slowing Growth
bare minerals moxie,11,Steady Growth,Seasonal
bare minerals moxie gloss,12,Seasonal,Seasonal
bare minerals moxie maverick,11,Steady Growth,Seasonal
bare minerals must have lip gloss,2,Seasonal,Seasonal
bare minerals plumping gloss,96,Seasonal,Steady Growth
bare minerals spark plug,11,Steady Growth,Seasonal
bareminerals buttercream,64,Seasonal,Seasonal
bareminerals charmer,64,Seasonal,Seasonal
bareminerals charmer lip gloss,2,Seasonal,Slowing Growth
bareminerals crowd surfer lip gloss,2,Seasonal,Slowing Growth
bareminerals daredevil,64,Seasonal,Seasonal
bareminerals daredevil lip gloss,2,Seasonal,Seasonal
bareminerals everything lip gloss,2,Seasonal,Slowing Growth
bareminerals forbidden lip gloss,2,Seasonal,Steady Growth
bareminerals gen nude buttercream lipgloss,38,Seasonal,Seasonal
bareminerals gloss,12,Seasonal,Steady Decreasing
bareminerals groovy gloss,12,Seasonal,Steady Growth
bareminerals groovy lip gloss,2,Seasonal,Seasonal
bareminerals head turner lip gloss,2,Seasonal,Seasonal
bareminerals marvelous moxie daredevil,64,Seasonal,Steady Decreasing
bareminerals marvelous moxie lipgloss,64,Seasonal,Seasonal
bareminerals marvelous moxie maverick,64,Seasonal,Seasonal
bareminerals maverick,64,Seasonal,Seasonal
bareminerals maverick lip gloss,2,Seasonal,Seasonal
bareminerals mineralist gloss balm,12,Seasonal,Slowing Growth
bareminerals mineralist lip gloss balm,2,Seasonal,Steady Growth
bareminerals moxie 24 karat,64,Seasonal,Slowing Growth
bareminerals moxie charmer,64,Seasonal,Slowing Growth
bareminerals moxie daredevil,64,Seasonal,Seasonal
bareminerals moxie head turner,64,Seasonal,Slowing Growth
bareminerals moxie lip gloss,33,Seasonal,Seasonal
bareminerals moxie lip gloss charmer,33,Seasonal,Slowing Growth
bareminerals moxie lipgloss rebel,64,Seasonal,Steady Decreasing
bareminerals moxie night owl,64,Seasonal,Slowing Growth
bareminerals moxie plumping lip gloss,15,Seasonal,Seasonal
bareminerals moxie plumping lip gloss 24 karat,15,Seasonal,Slowing Growth
bareminerals moxie plumping lip gloss head turner,15,Seasonal,Slowing Growth
bareminerals moxie plumping lip gloss inspiration,15,Seasonal,Slowing Growth
bareminerals moxie plumping lip gloss maverick,15,Seasonal,Slowing Growth
bareminerals moxie plumping lip gloss spark plug,15,Seasonal,Slowing Growth
bareminerals moxie plumping lipgloss rebel,64,Seasonal,Slowing Growth
bareminerals moxie rebel,64,Seasonal,Seasonal
bareminerals moxie spark plug,64,Seasonal,Seasonal
bareminerals plumping lip gloss,15,Seasonal,Seasonal
bareminerals rebel lip gloss,2,Seasonal,Seasonal
bareminerals spark plug,64,Seasonal,Seasonal
bareminerals spark plug lip gloss,2,Seasonal,Seasonal
barium extreme lip plumper,72,Slowing Growth,Slowing Growth
barium lip plumper,0,Seasonal,Steady Growth
barry extreme lip plumper,72,Slowing Growth,Slowing Growth
barry lip plumper,0,Seasonal,Slowing Growth
barry m boujee lip gloss,2,Seasonal,Slowing Growth
barry m clear lip gloss,16,Steady Decreasing,Slowing Growth
barry m cosmetics lip plumper,0,Seasonal,Steady Growth
barry m cosmetics that's swell plumping lip gloss,15,Seasonal,Steady Growth
barry m cosmetics that's swell xxl 2 plumping lip gloss,15,Seasonal,Steady Growth
barry m cosmetics that's swell xxl lip gloss,85,Seasonal,Steady Growth
barry m extra extra lip plumper,48,Slowing Growth,Slowing Growth
barry m extreme lip plumper,72,Slowing Growth,Steady Growth
barry m extreme lip plumping gloss,14,Seasonal,Slowing Growth
barry m lip gloss,2,Seasonal,Seasonal
barry m lip gloss boujee,2,Seasonal,Slowing Growth
barry m lip gloss plumper,2,Seasonal,Slowing Growth
barry m lip gloss plumping,2,Seasonal,Slowing Growth
barry m lip gloss xxl,2,Seasonal,Slowing Growth
barry m lip plumper,0,Seasonal,Steady Growth
barry m lip plumper xxl,0,Seasonal,Slowing Growth
barry m lip plumping gloss,14,Seasonal,Steady Growth
barry m lip plumping gloss clear,14,Seasonal,Slowing Growth
barry m lip plumping gloss xxl,14,Seasonal,Slowing Growth
barry m lip xxl,53,Slowing Growth,Slowing Growth
barry m lip xxl lip plumper,0,Seasonal,Steady Growth
barry m plumper,83,Seasonal,Slowing Growth
barry m plumping gloss,96,Seasonal,Slowing Growth
barry m plumping lip gloss,15,Seasonal,Seasonal
barry m plumping lip gloss that's swell,15,Seasonal,Slowing Growth
barry m plumping lip gloss xxl,15,Seasonal,Slowing Growth
barry m plumping lipgloss,38,Seasonal,Slowing Growth
barry m swell lip gloss,2,Seasonal,Slowing Growth
barry m that's swell lip gloss,2,Seasonal,Slowing Growth
barry m that's swell plumping lip gloss,15,Seasonal,Slowing Growth
barry m that's swell plumping lip gloss xxl,15,Seasonal,Slowing Growth
barry m that's swell plumping lip gloss xxl 2.5 ml,15,Seasonal,Slowing Growth
barry m that's swell xxl lip gloss,85,Seasonal,Steady Growth
barry m that's swell xxl plumping lip gloss,15,Seasonal,Steady Growth
barry m xxl,11,Steady Growth,Slowing Growth
barry m xxl extreme lip plumper,72,Slowing Growth,Slowing Growth
barry m xxl lip,53,Slowing Growth,Slowing Growth
barry m xxl lip gloss,85,Seasonal,Slowing Growth
barry m xxl lip plumper,0,Seasonal,Steady Growth
barry m xxl lip plumping gloss,14,Seasonal,Slowing Growth
barry m xxl plumping lip gloss,15,Seasonal,Steady Growth
barry m xxl swell lip gloss,2,Seasonal,Slowing Growth
barry m xxxl lip plumper,0,Seasonal,Slowing Growth
barry m xxxl plumping lip gloss,15,Seasonal,Steady Decreasing
barrym xxxl,11,Steady Growth,Slowing Growth
basic beauty lip gloss in literally,86,Seasonal,Stable
bath and body lip gloss,2,Seasonal,Seasonal
batman fake tattoos,9,Steady Decreasing,Slowing Growth
be a bombshell lip gloss,2,Seasonal,Seasonal
beautiful fake tattoos,9,Steady Decreasing,Slowing Growth
beautiful lip gloss,2,Seasonal,Seasonal
beautiful plumper,83,Seasonal,Seasonal
beauty bay lip plumper,0,Seasonal,Steady Decreasing
beauty bio lip plumper,0,Seasonal,Slowing Growth
beauty boss lip gloss,2,Seasonal,Steady Growth
beauty by popsugar lip gloss,2,Seasonal,Steady Growth
beauty counter lip gloss,2,Seasonal,Seasonal
beauty creations lip gloss,2,Seasonal,Seasonal
beauty creations lip gloss set,10,Seasonal,Steady Growth
beauty creations long wear matte lipgloss,38,Seasonal,Seasonal
beauty creations matte lip gloss,97,Seasonal,Seasonal
beauty for real lip gloss,2,Seasonal,Seasonal
beauty guru lip plumper,0,Seasonal,Steady Growth
beauty lip gloss,86,Seasonal,Seasonal
beauty rush lip gloss,2,Seasonal,Seasonal
beauty society lip plumper,0,Seasonal,Slowing Growth
beauty supply store lip gloss,2,Seasonal,Seasonal
beauty treats aloe lip gloss,2,Seasonal,Seasonal
beauty treats lip gloss,2,Seasonal,Seasonal
beauty treats lip shiner fruit lip gloss,2,Seasonal,Seasonal
beautybio the pout sparkling rosé hyaluronic acid collagen plumping lip serum,53,Slowing Growth,Slowing Growth
beautycounter lip gloss,2,Seasonal,Seasonal
bebe plumping lip gloss,15,Seasonal,Steady Growth
becca cosmetics lip gloss,2,Seasonal,Seasonal
becca lip gloss,2,Seasonal,Fast Decreasing
beckisue lip gloss,2,Seasonal,Slowing Growth
bee fake tattoo,5,Seasonal,Slowing Growth
bee lip plumper,0,Seasonal,Seasonal
bee sting lip balm,53,Slowing Growth,Steady Decreasing
bee sting lip gloss,2,Seasonal,Seasonal
bee sting lip plumper,0,Seasonal,Seasonal
bee venom for lips,11,Steady Growth,Seasonal
bee venom lip balm,53,Slowing Growth,Seasonal
bee venom lip gloss,2,Seasonal,Seasonal
bee venom lip plumper,0,Seasonal,Seasonal
bee venom lip plumper eveline,0,Seasonal,Slowing Growth
beefly temporary tattoos,8,Seasonal,Steady Growth
beeswax lip gloss,2,Seasonal,Seasonal
beige lip gloss,2,Seasonal,Steady Growth
belle en argent lip gloss,2,Seasonal,Fast Decreasing
benecos lipgloss,38,Seasonal,Steady Decreasing
benefit dandelion lip gloss,2,Seasonal,Seasonal
benefit hoola lip gloss,2,Seasonal,Seasonal
benefit lip gloss,2,Seasonal,Seasonal
benefit lip gloss set,10,Seasonal,Steady Decreasing
benefit lip plumper,0,Seasonal,Steady Decreasing
benefit plumping lip gloss,15,Seasonal,Steady Decreasing
benefit sugarbomb lip gloss,2,Seasonal,Seasonal
benefit ultra plush lip gloss,2,Seasonal,Seasonal
benzyl nicotinate lip plumper,0,Seasonal,Slowing Growth
berry juicy lip gloss,75,Seasonal,Slowing Growth
berry juicy lip gloss rude,75,Seasonal,Slowing Growth
berry lip gloss,2,Seasonal,Seasonal
best affordable lip gloss,2,Seasonal,Seasonal
best affordable lip plumper,0,Seasonal,Seasonal
best affordable plumping lip gloss,15,Seasonal,Slowing Growth
best amazon lip plumper,0,Seasonal,Steady Growth
best anti aging lip plumper,0,Seasonal,Seasonal
best at home lip plumper,0,Seasonal,Seasonal
best brown lip gloss,2,Seasonal,Seasonal
best budget lip plumper,0,Seasonal,Slowing Growth
best buxom lip gloss,7,Seasonal,Seasonal
best buxom lip gloss color,7,Seasonal,Seasonal
best buxom lip gloss shade,7,Seasonal,Slowing Growth
best cheap lip gloss,2,Seasonal,Fast Decreasing
best cheap lip plumper,0,Seasonal,Seasonal
best cheap plumping lip gloss,15,Seasonal,Slowing Growth
best clear lip gloss,16,Steady Decreasing,Seasonal
best clear lip gloss 2020,16,Steady Decreasing,Steady Growth
best clear lip gloss plumper,16,Steady Decreasing,Slowing Growth
best clear lip plumper,0,Seasonal,Seasonal
best clear lip plumper gloss,84,Slowing Growth,Slowing Growth
best clear lip plumping gloss,14,Seasonal,Slowing Growth
best clear plumping lip gloss,15,Seasonal,Seasonal
best collagen lip balm,29,Seasonal,Slowing Growth
best collagen lip gloss,2,Seasonal,Steady Decreasing
best collagen lip plumper,0,Seasonal,Seasonal
best colored lip gloss,2,Seasonal,Seasonal
best cvs lip plumper,0,Seasonal,Seasonal
best drugstore clear lip gloss,16,Steady Decreasing,Fast Decreasing
best drugstore lip gloss,37,Slowing Growth,Fast Decreasing
best drugstore lip gloss plumper,37,Slowing Growth,Steady Growth
best drugstore lip plumper,37,Slowing Growth,Seasonal
best drugstore lip plumper 2020,37,Slowing Growth,Steady Growth
best drugstore lip plumper 2021,37,Slowing Growth,Slowing Growth
best drugstore lip plumper cvs,37,Slowing Growth,Slowing Growth
best drugstore lip plumper gloss,37,Slowing Growth,Seasonal
best drugstore lip plumper reddit,37,Slowing Growth,Slowing Growth
best drugstore lip plumper walmart,37,Slowing Growth,Slowing Growth
best drugstore lip plumping lip gloss,46,Seasonal,Slowing Growth
best drugstore plumping gloss,96,Seasonal,Seasonal
best drugstore plumping lip gloss,15,Seasonal,Seasonal
best euphoria makeup,4,Steady Growth,Slowing Growth
best euphoria makeup looks,52,Steady Growth,Steady Growth
best euphoria makeup products,4,Steady Growth,Slowing Growth
best everyday lip gloss,2,Seasonal,Seasonal
best extreme lip plumper,72,Slowing Growth,Slowing Growth
best eyeliner for fake tattoos,9,Steady Decreasing,Slowing Growth
best fake skin for tattooing,87,Steady Growth,Seasonal
best fake skin tattoo,81,Seasonal,Slowing Growth
best fake skin to tattoo on,81,Seasonal,Slowing Growth
best fake tattoo ink,5,Seasonal,Slowing Growth
best fake tattoo sleeves,58,Steady Growth,Seasonal
best fake tattoos,9,Steady Decreasing,Seasonal
best fake tattoos on amazon,9,Steady Decreasing,Slowing Growth
best fake tattoos that look real,25,Seasonal,Slowing Growth
best fenty lip gloss,42,Seasonal,Steady Growth
best flavored lip gloss,2,Seasonal,Seasonal
best friend fake tattoos,9,Steady Decreasing,Seasonal
best glitter lip gloss,2,Seasonal,Steady Decreasing
best glossy lip gloss,2,Seasonal,Seasonal
best hyaluronic acid lip plumper,0,Seasonal,Seasonal
best hyaluronic lip plumper,0,Seasonal,Slowing Growth
best hydrating lip gloss,2,Seasonal,Seasonal
best hydrating lip plumper,0,Seasonal,Slowing Growth
best ink for temporary tattoos,8,Seasonal,Seasonal
best instant lip plumper,0,Seasonal,Seasonal
best korean lip gloss,2,Seasonal,Seasonal
best korean lip plumper,0,Seasonal,Slowing Growth
best lip balm for fuller lips,29,Seasonal,Slowing Growth
best lip balm for plump lips,29,Seasonal,Seasonal
best lip balm for plumping,29,Seasonal,Slowing Growth
best lip balm to plump lips,29,Seasonal,Slowing Growth
best lip conditioner and plumper,76,Seasonal,Seasonal
best lip enhancer,53,Slowing Growth,Seasonal
best lip filler gloss,31,Seasonal,Slowing Growth
best lip filler lip gloss,31,Seasonal,Slowing Growth
best lip gloss,1,Steady Decreasing,Seasonal
best lip gloss 2020,1,Steady Decreasing,Accelerated Growth
best lip gloss 2021,1,Steady Decreasing,Steady Growth
best lip gloss at ulta,1,Steady Decreasing,Seasonal
best lip gloss brand,1,Steady Decreasing,Seasonal
best lip gloss for aging lips,1,Steady Decreasing,Steady Growth
best lip gloss for bigger lips,1,Steady Decreasing,Slowing Growth
best lip gloss for brown skin,1,Steady Decreasing,Seasonal
best lip gloss for dark lips,1,Steady Decreasing,Seasonal
best lip gloss for dark skin,1,Steady Decreasing,Seasonal
best lip gloss for dry lips,1,Steady Decreasing,Seasonal
best lip gloss for indian skin,1,Steady Decreasing,Seasonal
best lip gloss for lip fillers,1,Steady Decreasing,Slowing Growth
best lip gloss for plump lips,1,Steady Decreasing,Slowing Growth
best lip gloss for sensitive lips,1,Steady Decreasing,Seasonal
best lip gloss in the world,1,Steady Decreasing,Seasonal
best lip gloss on amazon,1,Steady Decreasing,Seasonal
best lip gloss plumper 2020,1,Steady Decreasing,Slowing Growth
best lip gloss reddit,1,Steady Decreasing,Steady Growth
best lip gloss sephora,1,Steady Decreasing,Seasonal
best lip gloss to make lips bigger,1,Steady Decreasing,Slowing Growth
best lip gloss ulta,1,Steady Decreasing,Seasonal
best lip injection gloss,3,Steady Growth,Seasonal
best lip injection lip gloss,69,Seasonal,Seasonal
best lip maximizer,53,Slowing Growth,Seasonal
best lip plumper,76,Seasonal,Accelerated Growth
best lip plumper 2020,76,Seasonal,Steady Growth
best lip plumper 2021,76,Seasonal,Steady Growth
best lip plumper amazon,76,Seasonal,Seasonal
best lip plumper and moisturizer,76,Seasonal,Steady Decreasing
best lip plumper and wrinkle reducer,76,Seasonal,Slowing Growth
best lip plumper at target,76,Seasonal,Seasonal
best lip plumper cheap,76,Seasonal,Slowing Growth
best lip plumper ever,76,Seasonal,Seasonal
best lip plumper for aging lips,76,Seasonal,Seasonal
best lip plumper for men,76,Seasonal,Slowing Growth
best lip plumper for thin lips,76,Seasonal,Seasonal
